{"fault_detected":true,"suspect_job":"job_1","suspect_function":"select_demand","explanation":"The two-job execution is faulty because the top-level corpus contains allowed record n06-r06 with need \"compare selected and complete runtime evidence\" and a matching downstream capability cap-compare, but Job 2's observed input and output omit n06-r06 entirely. The omission originates before Job 2: its supplied needs and evidence_sources handoffs already lack n06-r06. The visible upstream select_demand implementation selects only records with demand_score >= 6 or fallback_ids n06-r07/n06-r08, so n06-r06 with demand_score 5 is dropped despite the behavioural criteria requiring retained allowed record identities and exact handoffs.","cited_evidence":["top_level_input includes record_id n06-r06 with need \"compare selected and complete runtime evidence\", demand_score 5, source_id s06, source_weight 3.","Job 2 input needs and evidence_sources include n06-r01,n06-r02,n06-r03,n06-r04,n06-r05,n06-r07,n06-r08, but not n06-r06.","Job 2 capabilities include {\"capability_id\":\"cap-compare\",\"need\":\"compare selected and complete runtime evidence\"}, so the omitted n06-r06 would have mapped directly if handed downstream.","select_demand source filters with demand_score >= 6 or fallback_ids ['n06-r07','n06-r08'], excluding n06-r06."],"next_action":{"action":"expand_execution_group","execution_group_id":"grp-9f1f5c0739652038"}}