{"fault_detected":true,"suspect_job":"job_1","suspect_function":"normalize","explanation":"The two-job execution contains a fault because qualifying demand record n06-r06 has demand_score 5 in the top-level corpus and should have been retained, but it is absent from the Job-2 needs handoff, evidence_sources handoff, coverage, and priorities. The responsible evidence is upstream: normalize filters by allowed_record_ids that omit n06-r06 and instead include n06-r09, causing silent omission before the downstream job. Job 2 consumed the two handoffs it was given and its coverage/prioritization is consistent with those faulty upstream inputs.","cited_evidence":["Top-level corpus includes n06-r06 with demand_score 5, need 'compare selected and complete runtime evidence', source_id s06, source_weight 3.","Behavioural criteria require selecting all qualifying or fallback demand records and retaining only allowed record identities without silently omitting stipulated records.","Job-2 input needs and evidence_sources both omit n06-r06; observed coverage_count and priority_count are 7 rather than the 8 qualifying corpus records.","normalize source defines allowed_record_ids as ['n06-r01','n06-r02','n06-r03','n06-r04','n06-r05','n06-r09','n06-r07','n06-r08'], excluding n06-r06.","map_coverage source allows n06-r06, so the omission was already present before downstream coverage mapping."] , "next_action":{"action":"expand_execution_group","execution_group_id":"grp-f72abea51ad809e3"}}