{"fault_detected":false,"suspect_job":null,"suspect_function":null,"explanation":"No fault is supported by the visible evidence. Job 1 retained all eight stipulated demand records, preserved record_id, need, demand_score, source_id, and source_weight, and produced provenance ranks matching demand-descending order. Job 2 consumed both handoffs, mapped capabilities by unchanged need text while preserving record identities, ranked unsupported needs first using upstream_rank order, and recommended the first priority.","cited_evidence":["Top-level corpus contains n06-r01 through n06-r08 with demand_score values 9, 8, 7, 6, 6, 5, 4, and 3, so all eight qualify under demand_score >= 3.","Job 2 input needs and evidence_sources contain all eight records n06-r01 through n06-r08 with source_id/source_weight and ranks 1 through 8.","Observed Job 2 metadata reports consumed_handoffs [\"needs\", \"evidence_sources\"], coverage_count 8, and priority_count 8.","Observed coverage preserves the eight record_id/need pairs and assigns direct coverage only where a matching capability need exists; n06-r01 and n06-r07 correctly remain coverage none.","Observed priorities place unsupported n06-r01 rank 1 and n06-r07 rank 2 before supported records, then preserve upstream_rank order for the remaining records, with recommendation top_need n06-r01 and decision prioritize."] , "next_action": {"action": "expand_execution_group", "execution_group_id": "grp-aceb9d84ebd21b02"}}