{"fault_detected":false,"suspect_job":null,"suspect_function":null,"explanation":"Terminal decision is not yet appropriate because the interaction contract requires one execution-group expansion before terminal review. Expanding the downstream coverage loop first follows the downstream-first review framing and targets the function that maps retained needs to capabilities.","cited_evidence":["interaction_contract.required_before_terminal is true with operation expand_execution_group and maximum_completed_expansions 1.","disclosed_execution_groups is empty.","Collapsed downstream group grp-fd57ac6176182355 is in job_downstream_coverage_priority at map_coverage, for (_, row) in retained_df.iterrows()."],"next_action":{"action":"expand_execution_group","execution_group_id":"grp-fd57ac6176182355"}}